index,title,url,press,date,keyword,content,Scraped_date
36,"철강기업 투자자 관심도, 1위 포스코홀딩스·2위 현대제철·3위는?",http://www.newswatch.kr/news/articleView.html?idxno=65392,뉴스워치,2023.10.19.,포스코 해외 투자,"네이버 해외선물 투자 커뮤니티의 한 유저는 ""에코프로, 포스코홀딩스 소액 주주가 크게 늘어 앞으로 국민주가 될 수 있다""며 ""국민주든 뭐든 주가가 많이 올라 수익을 많이 줬으면 좋겠다""는 소망을 드러냈다. 현대제철은 지난 7월부터 9월까지 총 2만7777건의 포스팅 수로 2위에 자리했다....",2023-12-14
37,포스코그룹·AI반도체·일본반도체에 집중 투자하고 싶다면,https://www.mk.co.kr/article/10850561,매일경제,2023.10.16.,포스코 해외 투자,"16일 한국투자신탁운용은 국내주식형인 ACE 포스코그룹포커스 및 ACE AI반도체포커스 ETF와 더불어 해외주식형인 ACE 일본반도체 ETF 3종을 오는 17일 상장한다고 밝혔다. ACE 포스코그룹포커스 ETF는 한국투자신탁운용이 국내에서 처음으로 선보이는 그룹주 상품이다. 홀딩스, 퓨처엠...",2023-12-14
38,"한성희 역대 최장수 포스코이앤씨 CEO 도전, 5연임 변수는 그룹 인사",https://www.businesspost.co.kr/BP?command=article_view&num=332316,비즈니스포스트,2023.11.07.,포스코 해외 투자,"포스코그룹은 2019년 말 정기 임원인사에서 한 사장을 포스코이앤씨 대표이사로 선임하며 ""재무와 전략, 투자는 물론 해외경험도 풍부하다""고 설명하기도 했다. 한 사장은 취임 이후 포스코이앤씨의 도시정비 신규수주 기록을 갈아치웠다. 2020년 도시정비사업에서 2조7456억 원을 수주한 뒤 2021년 도시정비...",2023-12-14
39,"[더벨][2023 Korean Corporate Global IR]""한국채권 사고 싶어요""…해외투자자 투심 뜨거웠다",https://www.thebell.co.kr/free/content/ArticleView.asp?key=202311020656047240106067,더벨,2023.11.03.,포스코 해외 투자,"금리가 글로벌 시장을 뒤흔드는 최대 팩터(Factor)로 자리잡은 시기, 한국물(Korean paper)에 대한 해외 투자자의 관심이 한껏 고조됐다. 채권 시장... IR엔 기획재정부와 한국수출입은행, KT, 포스코, SK온, SK E&S, SK브로드밴드, 포스코퓨처엠, KB국민은행 등 한국물 이슈어 9곳이 참석했다. KB증권과...",2023-12-14
40,"개미들, 국내주식 시장 탈출 러시…미·중·일 등 해외 시장으로 눈 돌려",http://www.fntimes.com/html/view.php?ud=20231113165826750922f8e8c22c_18,한국금융신문,2023.11.13.,포스코 해외 투자,‘서학개미(해외주식 투자자)’로 변신하고 있다. 13일 한국거래소(이사장 손병두)에 따르면 개인투자자들은 이달 들어 13일까지 유가증권시장... 반면 매수 상위 종목은 ▲포스코홀딩스(2527억원) ▲포스코퓨처엠(1977억원) ▲삼성SDI(1835억원) ▲기아(1453억원) ▲하이브(1132억원) 등으로 나타났다....,2023-12-14
41,"포스코 최정우 회장, 국감 앞두고 해외출장…파업 리스크까지",http://www.segyebiz.com/newsView/20231011519946?OutUrl=naver,세계비즈,2023.10.11.,포스코 해외 투자,유럽 국가 대상 기업설명회(IR)를 통한 해외 투자자 유치가 목적이지만 보는 시선이 곱지 않다. 국회 교육위원회는 11일 최 회장을 증인으로 출석시켜 청탁금지법 위반 여부에 대해 시시비비를 따질 예정이었다. 최 회장은 태풍 카눈의 상륙시기였던 지난 8월5일부터 11일까지 홀딩스 사외이사들과 5박6일...,2023-12-14
42,정부 부처 주간일정 및 보도계획(11~15일),http://news.mt.co.kr/mtview.php?no=2023121010304346561,머니투데이,4일 전,포스코 해외 투자,"3분기 해외직접투자 동향 *한국의 사회동향 2023 *통계용어사전 온라인 서비스 16일(토) *24년도 제1차 G20 재무차관회의 결과 보도 ◆산업통산자원부... 세종 포스코퓨처엠) *장영진 1차관, 비상경제장관회의(오전8시, 세종청사) *장영진 1차관, 모빌리티충전산업 융합얼라이언스(오후4시, 웨스틴조선)...",2023-12-14
43,공매도 '8개월 전면 금지' 기간 돈 버는 투자전략,https://www.hankyung.com/article/2023111204591,한국경제언론사 선정,2023.11.12.,포스코 해외 투자,"그는 “특히 최근 1개월간 PER 저평가가 커졌지만, 증권사의 목표 주가가 상향된 종목군을 추천한다”며 “아모레G, 포스코인터내셔널, 에스엠, 넥센타이어, 현대위아 등이 투자 매력도가 크다”고 했다. 아모레G는 1개월 사이 PER이 21.4% 낮아지고, 목표주가는 11% 올랐다. 차라리 로 눈 돌린다면 변동성이...",2023-12-14
44,"포스코인터내셔널 에너지사업 이어 식량사업 박차, 정탁 세계 톱10 본다",https://www.businesspost.co.kr/BP?command=article_view&num=330719,비즈니스포스트,2023.10.23.,포스코 해외 투자,포스코인터내셔널과 바틀렛은 △곡물 조달사업과 대두 가공사업 합작 추진 △미국산 곡물의 안정적 조달체계 구축 및 해외 수출시장 공동 개발 등을 추진하기로 했다. 아울러 포스코인터내셔널은 바틀렛이 건설하고 있는 대두 가공법인에 연내 지분을 하고 원곡을 안정적으로 조달할 수 있는...,2023-12-14
45,"포스코인터내셔널, 美 곡물 기업과 식량 합작투자 위한 기본합의서 체결",http://www.segye.com/newsView/20230926505139?OutUrl=naver,세계일보,2023.09.26.,포스코 해외 투자,"포스코인터내셔널 관계자는 “우리나라의 지난해 곡물자급률은 19% 수준으로 쌀을 제외한 주요 곡물들을 대부분 수입에 의존하고 있다”며 “곡물 조달능력 증대와 해외자산 투자 등 해외 곡물 공급망 확보에 힘써 세계 10 위권 식량사업회사로 도약함과 동시에, 국가 식량안보에도 기여해 나가겠다”고...",2023-12-14
46,"포스코인터내셔널, 9일 기업설명회",http://www.newsis.com/view/?id=NISX20231103_0002507906&cID=10403&pID=15000,뉴시스,2023.11.03.,포스코 해외 투자,= 포스코인터내셔널은 오는 9일 해외 기관투자자를 대상으로 기업설명회를 진행한다고 3일 공시했다.,2023-12-14
47,"'44년 LG맨' 권영수, '아름다운 용퇴'의 옥에 티",https://news.einfomax.co.kr/news/articleView.html?idxno=4291048,연합인포맥스,2일 전,포스코 해외 투자,"대표적으로 거론되는 곳이 내년 3월 최정우 회장이 임기 만료를 앞둔 포스코그룹이에요. 사실 포스코 같은 경우는 권 부회장이 직접 ""말도 안 되는 얘기... 그간 자신이 해외 사업장 투자, 미래 고객 확보 등 '엔솔 1.0'을 성공적으로 구축한 만큼 새로운 리더십이 강력한 실행을 통해 '엔솔 2.0'을 준비해야 하는...",2023-12-14
48,[더벨][투자 포트폴리오 리포트/포스코홀딩스]리튬사업 최전선 기획자 '이복형·조응래 CFO',https://www.thebell.co.kr/free/content/ArticleView.asp?key=202309141749103800105268,더벨,2023.09.21.,포스코 해외 투자,◇'투자부서·해외법인 근무' 두 CFO 공통점 그 확장을 기획하는 인물들이 포스코필바라리튬솔루션의 이복형 경영기획실장과 포스코리튬솔루션의 조응래 경영기획실장이다. 둘은 모두 CFO이자 사내이사로 이사회에 참여하고 있다. 모회사이자 지주사인 포스코홀딩스의 정기섭 사장과 유병옥 부사장...,2023-12-14
49,[증권소식] 금융사 해외 부동산투자 부실 우려 1.3조/펀드사태로 21개사 129명 징계/미래에셋증권 PB 구속기소 등,https://www.asiatime.co.kr/article/20231011500003,아시아타임즈,2023.10.11.,포스코 해외 투자,◆ 국내 금융회사의 해외 부동산 투자 중 1조3000억원 규모가 부실 우려가 있는 것으로 나타났다. 또한 해외 부동산 대체투자의 4분의 1은 내년에... ◆ 한국거래소 유가증권시장본부는 스닥 상장 기업인 포스코 DX의 이전상장을 위한 예비심사신청서를 접수했다고 10일 밝혔다. 1989년 설립된 DX는...,2023-12-14
0,"한화진 환경장관 ""폐배터리는 순환자원""…규제 제외 반대",http://news.mt.co.kr/mtview.php?no=2023121016043061812,머니투데이,2일 전,현대자동차 배터리 재활용,"차량을 폐차하더라도 배터리 성능이 70~80% 유지돼 소형 이동기구, 캠핑용 전원, ESS(에너지저장장치) 등으로 재사용하거나 분쇄 후 새 배터리 원료를 추출하는 재활용이 가능하다. 현대자동차를 포함한 자동차업계와 배터리3사(LG에너지솔루션·SK온·삼성SDI) 등 24개 회사·기관이 참여한 ' 얼라이언스'는...",2023-12-14
1,이차전지 산업 현재·미래 한눈에…'울산 K-배터리 쇼' 개최,https://www.yna.co.kr/view/AKR20231207011800057?input=1195m,연합뉴스,7일 전,현대자동차 배터리 재활용,"1부에서는 이차전지 제조·활용 분야 대표 기업인 현대자동차 배터리개발센터 김창환 전무, 삼성SDI 중대형사업부 마케팅팀 고주영 부사장, LG에너지솔루션 박성빈 기술전략담당이 강연에 나선다. 2부에서는 울산의 이차전지 산업 발전 방안과 핵심 소재 기술 흐름, 차세대 전지 및 기술 동향을 주제로...",2023-12-14
2,‘2023 울산 케이-배터리 쇼’ 개최,http://www.knnews.co.kr/news/articleView.php?idxno=1420389,경남신문,7일 전,현대자동차 배터리 재활용,"1부 기조 강연에서는 이차전지 제조, 활용분야 대표 기업인 현대자동차 배터리개발센터 김창환 전무, 삼성SDI 중대형사업부 마케팅팀 고주영 부사장, LG에너지솔루션 박성빈 기술전략담당이 강연에 나선다. 2부 주제 발표는 울산의 이차전지 산업 발전 방안·핵심소재의 기술 흐름, 차세대전지. 기술...",2023-12-14
3,"[모닝픽] 성일하이텍, 에머슨과 협력하여 지속 가능한 배터리 재활용 시설 확장",http://www.g-enews.com/ko-kr/news/article/news_all/202312120400243019e8b8a793f7_1/article.html,글로벌이코노믹,2일 전,현대자동차 배터리 재활용,"◇현대차, 아이오닉 5 N보다 저렴한 소형 전기차 N 모델 출시 계획 현대자동차는 아이오닉 5 N보다 더 작고 저렴한 N 브랜드의 고성능 전기차를 출시할... ◇성일하이텍, 에머슨과 협력하여 지속 가능한 배터리 재활용 시설 확장 에머슨이 성일하이텍과 협력하여 그들의 리튬이온 시설을...",2023-12-14
4,"성일하이텍, 에머슨의 자동화 기술로 리튬이온 배터리 재활용 효율화",http://www.g-enews.com/ko-kr/news/article/news_all/202312121348249707e8b8a793f7_1/article.html,글로벌이코노믹,2일 전,현대자동차 배터리 재활용,"인도네시아는 니켈 매장량·채굴량이 세계에서 가장 많은 곳이며, LG에너지솔루션과 현대자동차의 전기차 배터리 합작법인도 인도네시아에 공장을 설립할 예정이다. 성일하이텍은 이들의 배터리 스크랩을 수거·재활용할 계획이다. 성일하이텍은 폐 분야의 선도 기업으로서, 에머슨과의...",2023-12-14
5,이차전지산업 현재·미래 한눈에…'울산 K-배터리쇼' 열려,https://www.ksilbo.co.kr/news/articleView.html?idxno=986810,경상일보,6일 전,현대자동차 배터리 재활용,"재사용, 재활용에 이르는 이차전지 생애 전주기 기업지원에 최선을 다하겠다""고 밝혔다. 이밖에도 행사에서는 LS MnM, 코스모화학, 에코케미칼, 이수스페셜티케미컬 등 울산 이차전지 대표 기업의 소재·부품, 현대자동차의 , 삼성SDI와 LG에너지솔루션의 이차전지가 전시됐다. 김두겸 울산시장은 ""이번...",2023-12-14
6,민간 아닌 공기관서 폐배터리 재활용… 환경오염 우려 말끔히 씻는다,https://www.munhwa.com/news/view.html?no=2023120501032521129002,문화일보,1주 전,현대자동차 배터리 재활용,재사용·재활용 처리를 기다리고 있었다. 이날 오전 수거센터에선 현대자동차 코나에 탑재됐던 배터리가 입고된 후 외관 검사와 전기적 검사를 거쳐 ‘항온 체임버’ 안에서 성능시험을 받고 있었다. 전기차 폐배터리 활용 방식은 크게 재제조·재사용· 등 세 가지다. 재제조는 상태가 좋은...,2023-12-14
7,자동차 배터리에 ‘여권’ 만든다…사용후 배터리 체계 마련,https://news.kbs.co.kr/news/pc/view/view.do?ncd=7817056&ref=A,KBS,2023.11.14.,현대자동차 배터리 재활용,"배터리 3사와 현대자동차 등이 사용된 자동차 배터리를 관리하고 재활용하는 방안을 마련해 정부에 제출했습니다. 산업통상자원부는 배터리 3사와 현대차, 재활용 기업 등 24개 기관이 참여하고 있는 '배터리 얼라이언스'가 오늘(14일) '사용 후 통합관리체계' 업계안과 이를 뒷받침하는 법률안을 정부에...",2023-12-14
8,배터리 업계 “사용후 배터리 ‘폐기물’ 대신 ‘제품’ 취급 필요” 정부 제안,https://www.donga.com/news/Economy/article/all/20231114/122180409/1,동아일보,4주 전,현대자동차 배터리 재활용,"배터리협회와 배터리 3사, 현대자동차와 폐배터리 재사용·재활용 기업 성일하이텍, 폐차업계, 보험업계 등 24개 기업·기관이 지난해 11월부터 총 11차례 회의해 도출한 합의안이다. 우선 배터리 업계는 현행법상 폐기물로 취급되고 있는 사용후 를 제품으로 정의할 것을 요청했다. 폐기물이 아닌...",2023-12-14
9,"국립부경대생팀, 미래 자동차산업 아이디어 공모전 ‘우수’",https://www.busan.com/view/busan/view.php?code=2023120110303422718,부산일보,1주 전,현대자동차 배터리 재활용,이들은 자동차부품산업진흥재단이 개최하고 현대자동차그룹이 후원한 이번 공모전에서 ‘전기차용 폐 LiFePO4 전지의 열처리 온도에 따른 재활용 방안 분석 및 제시’ 작품으로 수상했다. 이들은 이 작품에서 배터리 수요 증가로 폐도 늘어감에 따라 의 중요성이 대두되고 있는 상황에서...,2023-12-14
10,"재활용 → 새활용, 지구 건강도 '업'",http://www.kyeongin.com/main/view.php?key=20231201010006176,경인일보,1주 전,현대자동차 배터리 재활용,"의왕시 소재 포엔은 현대자동차 아이오닉에 들어가는 전기차 폐배터리를 재제조해, 다시 현대차와 기아에 납품한다. 마찬가지로 양주시 소재... 리맨 관계자는 ""순환경제의 중요성을 인식해 15년 전부터 디지털 기기를 수거해 재사용·재제조· 처리하고 있다""며 ""개인 정보 유출 문제로 디지털 기기를...",2023-12-14
11,"""아이디어 있으면 언제든""…현대차그룹, 사내 스타트업 3곳 분사",https://www.hankyung.com/article/202311213412i,한국경제,3주 전,현대자동차 배터리 재활용,"현대자동차그룹은 사내 스타트업인 에픽카와 에이치충전연구소, 쓰리아이솔루션 등 세 곳을 분사시켰다고 21일 발표했다. 에픽카는 수리 비용을 절감할... 친환경 부품을 사용하면 자원 재활용을 통해 에너지 절약과 탄소 배출량 감축에 기여할 수 있고 차량 유지비와 수리비도 절감된다. 에픽카는 이러한...",2023-12-14
12,"""현대차에 몰리는 글로벌 인재…첨단 제조‧배터리 재활용 협력""",https://www.sedaily.com/NewsView/29XC2SLF4V,서울경제언론사 선정,3주 전,현대자동차 배터리 재활용,"“현대차는 싱가포르에서 K드라마, K팝 수준으로 글로벌 인지도가 높아 많은 학생들이 지원하고 있습니다.”(조남준 싱가포르 난양이공대학 재료공학부 석좌교수) 현대자동차그룹이 글로벌 인재를 활용한 모빌리티 첨단 제조 및 기술 개발에 팔을 걷는다. 우수 인재를 확보한 싱가포르...",2023-12-14
13,"[물류24시] 현대차그룹, 안전 아이디어 공모전 外",https://dealsite.co.kr/articles/113849,딜사이트,2주 전,현대자동차 배터리 재활용,"◆현대차그룹, 안전 아이디어 공모전 현대자동차그룹이 이달 24일 서울 영등포구 현대건설 기술교육원에서 김걸 현대차그룹 기획조정실장(사장)을... 투자자 이해 증진 및 기업가치 홍보를 위해 마련된 이번 행사에서는 납축전지 (LAB) 부분 글로벌 판매 순위 7위 경쟁력을 보유한 한국앤컴퍼니의...",2023-12-14
14,"배터리업계, 완성차업계의 배터리사업 진출에도 '자신감'",http://www.metroseoul.co.kr/article/20231120500292,메트로신문,3주 전,현대자동차 배터리 재활용,현대자동차는 전기차 경쟁력 강화를 위해 10년간 9조5000억원을 투자해 배터리 성능 향상 및 차세대 배터리 선행기술 개발과 인프라 구축에 나선다. 또한... 또 폐배터리 재활용 등을 포함한 배터리 가치사슬(밸류체인) 전반에 걸쳐 협력을 확대할 계획이다. 업계는 숙련된 인력 양성을 통한 경쟁력...,2023-12-14
15,"""전기차 붐은 온다""…충전인프라‧배터리 솔루션 봇물",http://www.thefirstmedia.net/news/articleView.html?idxno=133223,더퍼스트,1주 전,현대자동차 배터리 재활용,"현대자동차의 사내벤처 기업 출신의 이 회사는 전기차 사용 후 배터리를 재제조하는 기술로 전기차 문화 확산에 기여하고 있다. 최성진 포엔 대표는... 손일 알디솔루션 대표는 ""세계 폐배터리 재활용 시장 규모는 오는 2040년까지 230조원 규모로 성장할 것으로 전망된다""면서 ""앞으로 세계적인 폐...",2023-12-14
16,"울산자유구역청, '2023 울산 케이-배터리 쇼' 12월 7일 개최",http://www.industrynews.co.kr/news/articleView.html?idxno=51707,인더스트리뉴스,1주 전,현대자동차 배터리 재활용,"발표자들은 울산의 이차전지 산업 발전 방안, 핵심소재의 기술 흐름, 차세대전지 및 재활용 기술 동향 등을 주제로 말한다. 이어 △엘에스 엠엔엠(LS MnM) △코스모화학 △에코케미칼 △이수스페셜티케미칼 등 울산 지역 기업들은 전시 부스를 연다. 는 고전압, 삼성SDI와 LG에너지솔루션은...",2023-12-14
17,폐배터리 리사이클링 나서는 기업들,http://www.wsobi.com/news/articleView.html?idxno=221859,여성소비자신문,3주 전,현대자동차 배터리 재활용,"이 가운데 SK에코플랜트, LG화학, 현대자동차그룹, 포스코홀딩스 등 국내 기업들이 폐배터리 재활용 및 재사용 사업에 나섰다. 폐배터리에 포함된 리튬, 코발트, 니켈 등 그간 수입에 의존해 온 희소금속의 재활용을 통해 공급망 안정화에 나선다는 전략이다. SK에코플랜트, 폐 순환체계 구축 나서...",2023-12-14
18,"혁신 아이디어 사내 스타트업 3곳 분사…현대차그룹 ""오픈이노베이션 지속""",http://www.4th.kr/news/articleView.html?idxno=2051749,포쓰저널,3주 전,현대자동차 배터리 재활용,포쓰저널 서영길 기자 2023년 7월 21일 드림플러스 강남 제로원 공간에서 현대자동차그룹 사내 스타트업 대표들이 한 자리에 모여 단체 사진을 촬영하고... 친환경 부품을 사용하면 자원 재활용을 통해 에너지 절약과 탄소 배출량 감축에 기여할 수 있고 차량 유지비와 수리비도 절감된다. 에픽카는 차량에 맞는...,2023-12-14
19,"국내 전기차 배터리 가격, 배보다 배꼽이 더 크다",https://www.eroun.net/news/articleView.html?idxno=38952,이로운넷,2주 전,현대자동차 배터리 재활용,현대모비스의 현대 전기차 배터리 부품모델명과 현대자동차의 모델 가격표가 일치되지 않아 사실상 소비자들은 배터리 가격 확인이 불가능하다.... 1~2년 후부터 폐배터리가 쏟아질 것으로 예상된다. 정부 차원에서 전기차 수리 및 시장 활성화를 위해 정책적 지원이 시급한 실정이다.,2023-12-14
20,"현대자동차그룹, 사내 스타트업 3개사 분사…'혁신 아이디어와 열정 갖춰'",https://www.incheonilbo.com/news/articleView.html?idxno=1221771,인천일보,3주 전,현대자동차 배터리 재활용,"철강, 비철금속, 폐배터리 등의 산업에서 정확한 원재료 성분 파악은 품질, 원가 절감과 직결되기 때문에 다량의 원재료 성분을 빠르고 정확하게 파악하는 일이 중요하다. 현대자동차그룹은 2000년부터 사내 스타트업 육성 프로그램인 '벤처플라자'를 운영해 왔다. 2021년에는 '제로원 컴퍼니빌더'로 명칭을...",2023-12-14
21,전기차 배터리 재활용 시장 열린다…폐기물 아닌 자원으로 격상,https://www.mediapen.com/news/view/872087,미디어펜,4주 전,현대자동차 배터리 재활용,"사용 후 배터리 재활용 도식. /사진=현대자동차 홈페이지 캡처 국내 배터리 관련 24개 업체 및 기관이 작년 11월 만든 배터리 얼라이언스에는 국내 배터리 3사, 현대차그룹을 포함한 국내 배터리 업계를 총망라했다. 배터리 얼라이언스는 지난 1년 간 논의를 바탕으로 공급망 강화를 위한 ' 여권 제도...",2023-12-14
22,민간 주도 ‘사용후 배터리’ 거래 시장 열린다,https://www.dnews.co.kr/uhtml/view.jsp?idxno=202311141147268900432,대한경제,4주 전,현대자동차 배터리 재활용,"14일 산업통상자원부에 따르면 LG에너지솔루션, SK온, 삼성SDI, 현대자동차ㆍ모비스ㆍ글로비스 등 24개 업체 및 기관이 참여중인 배터리 얼라이언스는 1년... 업계는 현행 법령상 ‘폐기물’로 분류되는 사용 후 배터리를 ‘전기차에서 분리돼 재제조ㆍ재사용ㆍ 대상이 되는 ’로 새롭게 정의해야...",2023-12-14
23,"車-배터리-전자…‘니켈 매장량 1위’ 첨단산업 격전지로 [한-인니 수교 50주년, 성장판 커진다]",http://news.heraldcorp.com/view.php?ud=20231124000680,헤럴드경제,2주 전,현대자동차 배터리 재활용,자원·인구 대국 인도네시아가 배터리 생태계를 중심으로 격전지가 되고 있다. 세계 니켈 매장량 1위 등 원자재 보유국인 만큼 국내외 기업의 투자가 잇따르고 있다. 이에 인도네시아 자동차 시장에선 우리나라 회사가 전기차 시장 1위를 탈환하는 등 지각변동이 진행 중이다. 실제 는 아세안 권역...,2023-12-14
24,"[직장 돋보기 분석] SK온, 평균연봉 1억600만원인 글로벌 배터리 기업…4분기 흑자전환으로 '질적성장 시대' 개막?",https://www.news2day.co.kr/article/20231204500002,뉴스투데이,7일 전,현대자동차 배터리 재활용,"폐배터리 재활용 분야 솔루션 제공에도 힘쓰고 있다. SK온은 BASF와의 협력을 통해 SK온의 원소재 공급망 강화를 기대하고 있다. 양극재 분야를 넘어 다양한 분야 협력으로 이어져 글로벌 배터리 시장 선도를 내다보고 있다. 또, SK온과 그룹의 합작 공장 프로젝트가 미국 조지아주...",2023-12-14
25,"포엔, 전기차 배터리 재제조 솔루션으로 CES 2024 혁신상 받아... ""전기차 산업의 큰 변화 주도한다!""",https://kr.aving.net/news/articleView.html?idxno=1786227,에이빙뉴스,3주 전,현대자동차 배터리 재활용,"포엔은 현대자동차 사내벤처 기업이자 배터리 업사이클링 기술 및 프로세스에 특화된 역량을 보유한 업체로, 지난 2019년 설립 이래 관련 사업을 지속... 포엔은 사용주기를 마친 전기차 배터리를 입수하고, 이를 차별화된 기술력으로 검사, 진단한다. 이후 안전성을 입증한 시스템으로 분해하고, ...",2023-12-14
26,"그린라이언, 리튬인산철 배터리 재활용 기술 확보",http://www.thelec.kr/news/articleView.html?idxno=24362,디일렉,2주 전,현대자동차 배터리 재활용,"시장 상황도 리튬인산철 배터리 재활용의 필요성을 한층 높이고 있다. 현대자동차그룹이 코나, 레이, 니로 등의 신형 전기차에 리튬인산철 배터리를 탑재해 판매 중이다. 테슬라도 모델3‧Y에 리튬인산철 배터리 모델을 추가해 국내에 공급하고 있다. 아직 국내에 판매되지는 않지만 BMW와 메르세데스 벤츠...",2023-12-14
27,전기차 폐배터리 리사이클 어디까지 왔나,http://www.srtimes.kr/news/articleView.html?idxno=145940,SR타임스,3주 전,현대자동차 배터리 재활용,"국토교통부와 환경부가 폐배터리 등록과 탈거를 수행하고 환경부에서 재활용을 담당하게 되는 방식이다. 산업통상자원부에서는 재제조와 재사용을 도맡아 수행한다. 업계에서는 국내 배터리 3사(LG에너지솔루션, 삼성SDI, SK온)와 등이 참여하고 있는 얼라이언스를 통해 '사용 후 ...",2023-12-14
