index,title,url,press,date,keyword,content,Scraped_date
0,"""삼성SDS, 내년 클라우드 성장 원년될 것""-대신",https://www.hankyung.com/article/2023121451516,한국경제,6시간 전,삼성 SDS 투자,"대신증권은 삼성에스디에스(삼성SDS)에 대해 내년 클라우드 성장의 원년이 될 것이라며 투자의견 '매수', 목표주가 21만원을 제시했다. 이지은 대신증권 연구원은 14일 ""삼성SDS는 내년 1분기 생성형 인공지능(AI) 서비스인 브리티 코파일럿 일부와 패브릭스를 출시할 예정""이라며 ""생성형 AI 서비스들이...",2023-12-14
1,"삼성SDS, AI 앞세워 다시 쓰는 연고점",https://view.asiae.co.kr/article/2023121116265159105,아시아경제,1일 전,삼성 SDS 투자,13일 금융투자업계에 따르면 삼성SDS 주가는 올해 들어 38.7%가량 올랐다. 같은 기간 코스피는 13.4% 상승했다. 2021년 9월 이후 2년3개월 만에 17만원선을 회복했다. 11일 장중 한때 17만3300원을 기록하면서 연중 최고치를 경신했다. 기관 자가 최근 1개월 동안 1095억원 순매수를 기록하며 주가 상승을...,2023-12-14
2,"국내 기업들, 정보보호에 1.8조 투자…삼성전자·KT·쿠팡 순",http://news.tf.co.kr/read/economy/2060759.htm,더팩트언론사 선정,4일 전,삼성 SDS 투자,"IT분야 제조업인 삼성전자는 올해 정보보호 관련 투자만 2435억 원을 집행했으며, 904.2명이 정보보호에 전담하면서 전담인력이 가장 많은 기업에도 이름을 올렸다. 이 외에도 KT(1035억 원), 쿠팡(639억 원), SK하이닉스(590억 원), SK텔레콤(550억 원), 국민은행(542억 원), (530억 원), LG전자(457억 원)...",2023-12-14
3,"NH證 ""삼성SDS, 내년 초 생성형 AI 출시 기대…목표가↑""",http://www.newsis.com/view/?id=NISX20231207_0002549094&cID=10403&pID=15000,뉴시스,7일 전,삼성 SDS 투자,"NH투자증권은 7일 삼성SDS에 대해 ""정보기술(IT) 투자 축소, 물동량과 운임 약세 등 어려운 업황에도 클라우드 고성장을 통한 외형 성장과 수익성 개선, 디지털 포워딩 서비스 적용 확대로 대응하고 있다""며 ""내년 초 기업형 생성형 인공지능(AI) 서비스 출시 등 IT서비스, 물류사업 고도화가 기대된다""고...",2023-12-14
4,"[특징주]컴퍼니케이, 삼성 협업 ‘솔라’ 美 ‘오픈AI’ 꺾고 전세계 시장 1위 넘본다…초기투자社 강세",https://www.dnews.co.kr/uhtml/view.jsp?idxno=202312141322132440776,대한경제,45분 전,삼성 SDS 투자,"업스테이지는 AI시스템을 삼성생명 및 삼성SDS에 공급하는 업체로, 세계 최대 AI 플랫폼 허깅페이스가 운영하는 ‘오픈 LLM 리더보드’에서 세계 1위를 차지한 사전학습 LLM 'SOLAR(솔라)'를 공개했다고 14일 밝혔다. 이에 업계에서는 ‘솔라’의 전 세계 시장 점유율 1위를 관망하고 있는데, 초기 를...",2023-12-14
5,"SK證 ""삼성SDS, IT서비스 매출 증가 전망…목표가 ↑""",https://www.sedaily.com/NewsView/29YF47UUGY,서울경제,7일 전,삼성 SDS 투자,"전날 삼성SDS는 1.21% 내린 16만 3800원에 거래를 마쳤다. 삼성SDS의 올해 4분기 매출과 영업이익은 각각 3조 5159억 원, 2026억 원으로 시장 컨센서스에... IT 투자가 점진적으로 늘어날 것으로 보이는 점도 긍정적”이라고 분석했다. 내년 1분기에는 생성형 인공지능(AI) 서비스 출시가 예상돼 IT 서비스...",2023-12-14
6,"삼성SDS, 클라우드 고성장·생성형 AI 출시…실적 모멘텀 강화",https://www.etoday.co.kr/news/view/2309508,이투데이,7일 전,삼성 SDS 투자,"김동양 NH투자증권 연구원은 “삼성SDS는 IT 투자 축소, 물동량 및 운임 약세 등 어려운 업황에도 클라우드 고성장 통한 외형 성장과 수익성 개선, 디지털 포워딩 서비스 적용 확대로 대응했다”며 “2024년 초 기업형 생성형 AI 서비스 출시 등 IT서비스 및 물류사업 고도화 기대된다”고 밝혔다....",2023-12-14
7,"국내 기업, 정보보호 투자액 늘렸다",https://www.incheonilbo.com/news/articleView.html?idxno=1224958,인천일보,2일 전,삼성 SDS 투자,"정보보호 투자액 상위 10대 기업은 삼성전자, KT, 쿠팡, SK하이닉스, SK텔레콤, 국민은행, 삼성SDS, LG전자, LG유플러스, 네이버 순이다. 업종별 1위 기업은 제조업의 경우 삼성전자(2435억원·904.2명), 정보통신업은 KT(1035억원·303.8명), 도매 및 소매업은 쿠팡(639억원·167.7명) 등이다. 또 금융·보험업은...",2023-12-14
8,"[더벨]박경정 전 삼성SDS CFO, H&S하이텍 이사회 합류",https://www.thebell.co.kr/free/content/ArticleView.asp?key=202312081543592880105090,더벨,1일 전,삼성 SDS 투자,"박경정 전 삼성SDS 부사장이 코넥스 상장사인 H&S하이텍 이사회에 합류한다. 박 부사장은 사외이사로서 경영진 견제와 함께 회사에 필요한 재무·회계... 이처럼 준수한 실적과 수익성, 투자자들의 높은 관심도에 비해 이사회 구성은 아쉽다는 평가를 받는다. 일단 현재 사내이사가 3명, 사외이사 2명으로...",2023-12-14
9,"황성우 삼성SDS 사장, 연임성공했지만…'클라우드·AI 경쟁' 산 넘어 산[어바웃 C]",https://www.bloter.net/news/articleView.html?idxno=608852,블로터언론사 선정,2주 전,삼성 SDS 투자,"하지만 오랫동안 삼성SDS에 투자한 주주들을 만족시킬 수준이 아니라는 것은 황 사장도 잘 알고 있다. 한편, 삼성SDS는 이날 부사장 2명, 상무 7명 등 총 9명 규모의 2024년 정기 임원 인사를 단행했다. 김대우 솔루션사업부 솔루션개발실장(상무)과 오영석 통합보안센터장(상무)이 부사장으로 승진했으며...",2023-12-14
10,"SK증권 ""삼성SDS, 내년 기업가치 증가 예상…목표주가 23.5% 상향""",https://www.news1.kr/articles/5253971,뉴스1,7일 전,삼성 SDS 투자,"투자의견은 매수를 유지했다. 최관순 SK증권 연구원은 7일 보고서를 통해 ""삼성SDS는 올해 체질개선을 통한 장기 성장 동력을 확보했다""며 이같이 밝혔다. 최 연구원은 ""삼성SDS는 지난 11월28일 동탄 데이터센터를 활용한 4608억원 규모의 HPC 클라우드 서비스 계약을 체결했는데 고객사의 IT 가...",2023-12-14
11,'삼성SDS타워 8500억'…서울 상업용 부동산 거래 15개월 만에 최대,http://www.newsis.com/view/?id=NISX20231201_0002542489&cID=10401&pID=10400,뉴시스언론사 선정,1주 전,삼성 SDS 투자,"올해 상업용 부동산 ‘최대어’로 꼽힌 서울 송파구 신천동 소재 '삼성SDS타워'가 8500억원에 거래된 효과다. 1일 상업용 부동산 종합 서비스 기업... 류강민 알스퀘어 리서치센터장은 ""높은 금리 탓에 투자하기 쉽지 않은 환경이지만, 안정적인 임대시장 덕분에 거래 규모가 감소한 가운데에서도...",2023-12-14
12,"SK증권 ""삼성SDS 내년 실적 우상향""...목표가 상향",http://www.fnnews.com/news/202312070854500323,파이낸셜뉴스,7일 전,삼성 SDS 투자,"최 연구원은 ""삼성에스디에스는 지난 11월 28일 동탄 데이터 센터를 활용한 4608억원 규모의 HPC 클라우드 서비스 계약을 체결했는데 고객사의 IT 투자가 점진적으로 증가할 것으로 예상되는 점이 긍정적""이라며 ""또 2024년 1·4분기 생성형 AI 서비스 출시가 예상됨에 따라 내년 IT 서비스 부문 매출은...",2023-12-14
13,[Who Is ?] 최윤호 삼성SDI 대표이사 사장,https://www.businesspost.co.kr/BP?command=article_view&num=335267,비즈니스포스트,1주 전,삼성 SDS 투자,◆ 생애 최윤호는 삼성SDI 대표이사 사장이다. 삼성전자 미래전략실 출신의 재무 전문가로 삼성SDI 배터리사업의 대규모 투자를 추진하면서 '수익성... 같은 날 삼성SDS도 이사회를 통해 선임사회이사제도를 도입하기로 결정했다. 선임사외이사제도는 대표이사 또는 사내이사가 이사회 의장을 맡을...,2023-12-14
14,"다올證 ""삼성SDS, 성장 가시성 높아져…적정주가 19% 상향""",https://www.news1.kr/articles/5246845,뉴스1,2주 전,삼성 SDS 투자,"다올투자증권이 삼성SDS(018260)의 성장 가시성이 높아졌다며 적정주가를 21만원에서 25만원으로 19.04% 상향했다. 투자의견도 '매수'로 유지했다. 김하정 다올투자증권 연구원은 삼성SDS에 대해 ""그룹사 시스템통합(SI) 기업의 성장 가능성과 역할에 대한 의심, 낮은 클라우드 실적 가시성은 의...",2023-12-14
15,“기술주 투자 이 상품 하나로 끝…국내 대형 테크주에 분산투자” [자이앤트TV],https://www.mk.co.kr/article/10895456,매일경제,3일 전,삼성 SDS 투자,"삼성SDS, 크래프톤, 삼성전기, 엔씨소프트, LG이노텍 등 국내 대표 테크 기업 10곳을 담고 있습니다. SK하이닉스의 비중이 23.48%(11월 24일 기준)로 가장 높습니다. 정 부장은 “KOSEF K-테크 TOP10 ETF는 향후 10년 이상 폭발적으로 성장할 메가트렌드에 하는 상품”이라며 “국내 코스피와 코스닥 시장을...",2023-12-14
16,"[뉴투분석] 삼성SDS 황성우 호(號), '3마리 토끼'로 4차 산업혁명 파고 넘는다",https://www.news2day.co.kr/article/20231208500215,뉴스투데이,2일 전,삼성 SDS 투자,"삼성SDS 관계자는 뉴스투데이에 “앞으로 클라우드 사업과 디지털 물류 사업에 투자를 늘릴 것”이라며 “엠로 인수는 통합적 공급망관리(SCM) 역량과 클라우드 서비스 소프트웨어(SaaS) 사업을 강화하기 위한 행보”라고 설명했다. 그는 ""신종 코로나바이러스 감염증(코로나19) 팬데믹(대유행)과...",2023-12-14
17,"""7년 중 최소"" 바늘구멍 뚫은 삼성 임원, 3040 '젊은 피'로 채웠다",http://news.mt.co.kr/mtview.php?no=2023112915065676468,머니투데이,2주 전,삼성 SDS 투자,"조합 최적화 기술을 연구해 세계 최고 권위의 AI(인공지능) 학회인 NeurIPS(신경정보처리시스템학회)에 3년 연속으로 논문을 등재하는 등 향후 생성형 AI 연구를 통해 삼성SDS의 미래 혁신을 이끌 인재로 꼽혔다. 여성 승진자로는 사공경 상무를 배출했다. 벤처는 부사장 1명, 상무 2명이 승진했다.",2023-12-14
18,"삼성, 임원 승진 5년래 최저…39세 상무, 46세 부사장 ‘세대교체’ 가속",https://www.joongang.co.kr/article/25210987,중앙일보언론사 선정,2주 전,삼성 SDS 투자,김헌준 사욱환 오정원 조한제 ▶상무 권형진 김광수 김대식 김수한 김은하 김춘숙 문철환 이권열 이순률 이순재 임재광 정일형 조우진 최성욱 현장석 ◆삼성SDS ▶부사장 김대우 오영석 ▶상무 권영대 김성곤 김승기 배한욱 사공경 윤민식 창성중 ◆벤처 ▶부사장 장원상 ▶상무 권장혁 이철한,2023-12-14
19,"테슬라 주가 낮춘 사이버트럭 · 삼성 '미래' 수혜주, 'ABC'는 아닐 듯 [신인규의 이슈레이더]",https://www.wowtv.co.kr/NewsCenter/News/Read?articleId=A202312010024&t=NNv,한국경제TV언론사 선정,1주 전,삼성 SDS 투자,"하지만 투자자들은 테슬라 사이버트럭의 성능보다 가격과 생산 불안 가능성에 더 주목한 듯합니다. 테슬라 주가는 장 마감 한 시간 전 진행된... 코스피 대형주 가운데 삼성SDS가 어제 종가 기준으로 8.5% 상승했고요, 이건 내 시스템 통합 부문을 담당하는 가 의 미래 신사업에서 맡을 기대감이...",2023-12-14
20,삼성SDS·무신사성수 효과…서울 빌딩 거래액 15개월 만에 최대,https://www.joongang.co.kr/article/25211622,중앙일보,1주 전,삼성 SDS 투자,향후 10년간 삼성SDS가 전체 오피스를 임차해 10년간 공실 우려가 없다. 서울 성동구 성수2가에 있는 무신사 성수도 마스턴투자운용이 1115억원에 사들였다. 10월 거래 중 두 번째로 거래 규모가 컸다. 이로 인해 서울의 경우 10월 빌딩 거래금액이 1조6879억원으로 전달보다 77.5% 증가해 15개월 만에...,2023-12-14
21,"하나증권 “메타 IBM 뭉친 인공지능 동맹 기대감, 삼성전자 네이버 주목”",https://www.businesspost.co.kr/BP?command=article_view&num=335281,비즈니스포스트,1주 전,삼성 SDS 투자,"하나증권 리서치센터 글로벌투자분석팀은 6일 낸 '하나 구루 아이' 보고서에서 ""메타, IBM, 인텔, AMD 등 57개 기업이 챗GPT에 대항하기 위해... 네이버와 삼성SDS, 셀바스AI, 코난테크놀로지, 솔트룩스, 마음AI 등을 제시했다. 메타와 IBM을 주축으로 결성된 AI얼라이언스에는 AI기업과 연구기관 57개 기업이...",2023-12-14
22,"삼성SDS·전기 'AI 신바람'…기관·외국인, 쌍끌이 매수",https://www.hankyung.com/article/2023112891201,한국경제언론사 선정,2주 전,삼성 SDS 투자,"삼성전기는 적층세라믹콘덴서(MLCC)가 주력 사업인데, 온디바이스AI 기능이 확대되면서 실적이 개선될 것이라는 전망이 나온다. 온디바이스AI란 클라우드에 연결될 필요 없이 휴대폰 안에서 자체 작동하는 AI를 말한다. 전력 소비가 많기 때문에 MLCC가 더 많이 필요하다. 이규하 NH증권 연구원은...",2023-12-14
23,삼성전자 '미래단' 출범…신사업에 힘준다,https://www.asiatoday.co.kr/view.php?key=20231127010017506,아시아투데이,2주 전,삼성 SDS 투자,"삼성전자 각 부문장과 디스플레이, 삼성전기와 삼성SDS·삼성SDI, 더 나가면 삼성벤처투자 등이 거론된다. 따라서 기존 '미래전략실'과는 결이 다르다는 게 삼성측 설명이다. 미래단이 사업에만 국한 해 전자와 전자 관련 계열사 역량을 다 끌어 모으는 전자 대표이사 직속 조직이라면, 기존 미전실은 총수...",2023-12-14
24,“삼성 따라가면 망하진 않겠지”…신사업株 벌써 몰려든 개미들,https://www.mk.co.kr/article/10887844,매일경제언론사 선정,1주 전,삼성 SDS 투자,"삼성그룹 미래사업기획단 신설 발표 신산업 수혜업종 찾기 나서며 관련주↑ 인공지능·로봇·자율주행 종목들 급등 삼성SDS, 생산설비 AI화 기대에 신고가 M&A·지분투자 시간걸려 반짝상승 우려 지난 27일 삼성그룹이 사장단 인사와 함께 미래사업기획단 신설을 발표하면서 그룹내 미래 먹거리가 될...",2023-12-14
25,"삼성, 미래 먹거리 컨트롤타워 세웠다… “혼자선 10년 후 주도 못한다”",https://www.asiatoday.co.kr/view.php?key=20231127010017489,아시아투데이,2주 전,삼성 SDS 투자,"삼성전자 각 부문장과 디스플레이, 삼성전기와 삼성SDS·삼성SDI, 더 나가면 삼성벤처투자 등이 거론된다. 따라서 기존 '미래전략실'과는 결이 다르다는 게 삼성측 설명이다. 미래단이 사업에만 국한 해 전자와 전자 관련 계열사 역량을 다 끌어 모으는 전자 대표이사 직속 조직이라면, 기존 미전실은 총수...",2023-12-14
26,"[모닝픽] 삼성, 옥외 전자 디스플레이 특허 분쟁에서 승소",http://www.g-enews.com/ko-kr/news/article/news_all/202312090731175986e8b8a793f7_1/article.html,글로벌이코노믹,5일 전,삼성 SDS 투자,"이 공장은 연간 120만 톤의 생산 능력을 가지며, 총 투자액은 4조5000억 동이다. 공장 착공은 2024년부터 2026년 말까지 3단계에 걸쳐 진행될 예정이다.... ◇삼성, 옥외 전자 디스플레이 특허 분쟁에서 승소 미국 무역위원회(USITC)는 전자와 가 애틀랜타에 본사를 둔 매뉴팩처링 리소스...",2023-12-14
27,"삼성전자, 국내 정보보호 투자 1위…통신사는?",http://www.thelec.kr/news/articleView.html?idxno=24641,디일렉,3일 전,삼성 SDS 투자,정보보호 전담인력 상위 10대 기업은 ▲삼성전자 904.2명 ▲KT 303.8명 ▲삼성SDS 225.3명 ▲포스코 220.5명 ▲SK텔레콤 197.4명 ▲쿠팡 167.7명 ▲LG CNS 142.4명 ▲엔씨소프트 119.8명 ▲네이버 119.6명 ▲LG유플러스 117.3명 순이다. 한편 2년 연속 공시 이행 기업은 613개다. 평균 액은 28억원...,2023-12-14
28,코스피 소폭 하락세‥삼성SDS 3% ↑,https://imnews.imbc.com/replay/2023/nw1200/article/6548309_36170.html,MBC,2주 전,삼성 SDS 투자,"투자 주체별 매매 동향을 보면 코스피 시장에서는 개인 홀로 물량을 담고 있습니다. 지난밤 뉴욕 증시는 금리 인상 종결 기대감에 일제히... 반면 삼성SDS는 삼성전자와 대규모 공급 계약을 체결했다는 소식에 3% 이상의 강세 흐름을 나타내고 있고, JW중외제약이 실적 성장 기대감에 힘입어 5% 넘게 상승하고...",2023-12-14
29,'유임' 삼성 사장단 특명은 '배터리·OLED·AI·전장',https://www.dailian.co.kr/news/view/1301225/?sc=Naver,데일리안언론사 선정,2주 전,삼성 SDS 투자,"삼성SDS는 물류 부문에서는 운임 상승 및 물동량 증가를 예상하는 한편 지속 성장이 예상되는 클라우드에서는 관련 투자로 매출 증가를견인하겠다는 방침이다. 특히 '생성형 AI'를 도입해 업무 생산성을 높이려는 기업들이 증가하고 있는 점을 주목해, 클라우드 기반의 ‘기업형 Gen AI 서비스’를 내년...",2023-12-14
30,"삼성전자, 임원도 조기 인사…39세 상무·46세 부사장 ‘젊은 리더’ 발탁",https://www.joongang.co.kr/article/25211184,중앙일보,2주 전,삼성 SDS 투자,황희돈 발라지 소우리라잔 ◆삼성디스플레이 ▶부사장 김태우 윤재남 이건형 장근호 장철웅 전진 정성욱 정성호 한동원 허철 ◆삼성전기 ▶부사장 박선철 안병기 ◆삼성SDI ▶부사장 김윤재 김재경 김헌준 사욱환 오정원 조한제 ◆삼성SDS ▶부사장 김대우 오영석 ◆삼성벤처 ▶부사장 장원상,2023-12-14
31,재계 임원인사 마무리 국면···핵심 키워드 '성과주의·세대교체' 부상,https://www.youthdaily.co.kr/news/article.html?no=141039,청년일보,6일 전,삼성 SDS 투자,"삼성SDS는 미래 성장을 위한 도전과 혁신을 이끌 차세대 젊은 리더의 양성을 위해 창립 이래 최초로 30대 상무를 내부 승진시키는 등 나이를 뛰어넘어... 또한, SK㈜ 머티리얼즈 사장에 김양택 SK㈜ 첨단소재투자센터장(48)이, SK엔무브 사장에 김원기 SK엔무브 그린성장본부장(53)이 각각 보임됐다. 지난...",2023-12-14
32,"삼성SDS 수익성 개선 본궤도, 황성우 클라우드사업 육성 뚝심 통했다",https://www.businesspost.co.kr/BP?command=article_view&num=334914,비즈니스포스트,1주 전,삼성 SDS 투자,"김동양 NH투자증권 연구원은 ""삼성SDS는 어려운 업황 가운데도 클라우드 성장에 힘입어 수익성 개선이 이뤄지고 있다""고 말했다. 김 연구원은 삼성SDS의 올해 4분기 매출이 3515억 원으로 지난해 4분기보다 17.3% 감소하는 가운데 영업이익은 223억 원으로 오히려 6.4% 증가할 것으로 내다봤다. 이는...",2023-12-14
33,[경제계 인사] 삼성전자 외,https://www.chosun.com/economy/tech_it/2023/11/30/O7LQUPJJIBBANPM5C6KCI4RMBU/?utm_source=naver&utm_medium=referral&utm_campaign=naver-news,조선일보,2주 전,삼성 SDS 투자,허수영 ▲삼성SDS▷부사장 김대우 오영석▷상무 권영대 김성곤 김승기 배한욱 사공경 윤민식 창성중 ▲삼성벤처투자▷부사장 장원상▷상무 권장혁 이철한 ▲HD현대▷전무 강석주▲HD한국조선해양▷부사장 남영준 ▷전무 남궁훈 정병용 김민성 ▷상무 이재웅 조민수 김상현(전문위원) 설정훈(전문위원)...,2023-12-14
34,"한국투자증권 “엠로, 글로벌 통합 SCM 플랫폼…내년 실적 개선""",http://news.heraldcorp.com/view.php?ud=20231130000234,헤럴드경제,2주 전,삼성 SDS 투자,"윤철환 한국투자증권 연구원은 30일 보고서를 통해 “엠로는 대외적으로 어려운 환경에도 불구하고 대기업향 리커링(recurring) 매출이 선방하면서 올해 매출액이 전년 대비 9.6% 증가한 642억 원을 기록할 것으로 전망된다”며 “영업이익의 경우 , 오나인솔루션즈(o9 Solutions)와 함께 개발 중인...",2023-12-14
35,[인사] 삼성전자 ; 삼성전기 ; 삼성SDI 등,https://www.hankyung.com/article/2023112924051,한국경제,2주 전,삼성 SDS 투자,현장석 ◈삼성SDS◎승진<부사장>▷김대우 오영석<상무>▷권영대 김성곤 김승기 배한욱 사공경 윤민식 창성중 ◈삼성벤처투자◎승진<부사장>▷장원상<상무>▷권장혁 이철한 ◈HD현대◎승진◇HD현대<전무>▷강석주◇HD한국조선해양<부사장>▷장광필 남영준<전무>▷남궁훈 정병용 김민성<상무>▷이재웅 조민수...,2023-12-14
36,"“엠로, 내년 해외 진출...삼성SDS와 시너지 기대”",http://www.fnnews.com/news/202311211103233117,파이낸셜뉴스,3주 전,삼성 SDS 투자,"1% 증가한 458억 원을 기록했다”며 “다만 내년 해외 시장 진출 준비 및 글로벌 통합 공급망관리(SCM) SaaS 플랫폼 개발 관련 투자를 확대하며 수익성은 하락했다”고 분석했다. 또한, 현재 삼성SDS, 미국 공급망계획(SCP) 플랫폼 기업 오나인솔루션즈(o9 Solutions)와 협업해 내년 상반기 출시 예정인 글로벌...",2023-12-14
37,[일지]'삼성 부당합병 의혹' 수사 착수부터 이재용 구형까지,http://www.newsis.com/view/?id=NISX20231117_0002525407&cID=10201&pID=10200,뉴시스언론사 선정,3주 전,삼성 SDS 투자,"삼성물산·삼성 SDS 과천 데이터센터 등 10여곳 압수수색 ▲4월12일 -검찰, 미국계 다국적 투자은행 골드만삭스 등 압수수색 ▲4월25일 -검찰, 첫 구속영장 청구…삼성바이오에피스 임직원 대상 ▲4월29일 -바이오에피스 양모 상무·이모 부장 증거인멸 등 혐의 구속영장 발부 ▲5월3일 -바이오에피스 직원...",2023-12-14
38,"[대기업집단 탐구] ㉜삼성그룹, ""재계 1위 향후 30년 더 간다"" 전망 나오는 3가지 이유",http://www.thevaluenews.co.kr/news/view.php?idx=178360,더밸류뉴스,1주 전,삼성 SDS 투자,"삼성그룹의 미래는 어떤 프레임에 그려 넣어야 하는걸까. 여기에 맞춰 한국의 직장인, 경영자, 주식투자자, 취업준비생은 어떤 준비를 해야하는... 삼성그룹의 지주사에 해당하는 삼성물산(18.10%)을 비롯해 삼성생명(10.44%), 전자(1.63%), (9.20%) 지분을 갖고 있다. 그룹 오너 가계도와...",2023-12-14
39,삼성SDS타워 효과…10월 서울 상업용 부동산 거래 15개월만 최대,https://www.asiatime.co.kr/article/20231201500334,아시아타임즈,1주 전,삼성 SDS 투자,"9% 줄어 ""고금리로 투자 환경 좋지 않지만, 활발한 임대시장"" [아시아타임즈=정상명 기자] 지난 10월 서울 업무∙상업용 건물의 거래액이 약 80% 급증하며 월간 기준으로 15개월 만에 최대치를 기록했다. 올해 상업용 부동산 최대어로 꼽힌 서울 송파구 신천동 소재 ‘타워’가 8500억원에...",2023-12-14
40,"[더벨][Financial Index/삼성그룹]삼성전자, FCF 순유출 최대",https://www.thebell.co.kr/free/content/ArticleView.asp?key=202311231325190760103925,더벨,1주 전,삼성 SDS 투자,액수로는 삼성전자가 순유출 21조원으로 최대치를 기록했다. 잉여현금흐름은 영업활동현금흐름에서 시설투자 등 자본적지출(CAPEX)과 배당 등을... 그 다음으로는 같은 기간 4076억원에서 473억원로 88.4% 줄어든 삼성SDS가 있다. 순유출 액수로 따지면 가장 큰 곳은 전자다. 올 6월 말 순유출...,2023-12-14
41,KB자산운용 대체투자 3조 확대…2년 연속 1위 질주,https://www.sedaily.com/NewsView/29XBMBQ4LR,서울경제,3주 전,삼성 SDS 투자,올 들어 최대 부동산 거래인 삼성SDS 타워 매입을 포함해 인프라와 기업 지분 등 다양한 자산에 투자하며 2년 새 운용자산도 두 배 가까이 늘었다. 21일 금융투자협회에 따르면 KB자산운용의 대체투자 운용자산(AUM)은 32조 8426억 원으로 전체 운용사 중 1위에 올랐다. 2등인 이지스자산운용(26조 6508억...,2023-12-14
42,"""고금리에 리츠시장 어렵지만…투자 포기하지 않는다""",http://www.edaily.co.kr/news/newspath.asp?newsid=03758886635805720,이데일리,4주 전,삼성 SDS 투자,"“강남N타워, 삼성물산 서초사옥도 프라임급 오피스라는 거래 규모를 생각하면 SDS타워와 유사하게 매각 준비 작업이 이뤄지지 않을까 기대하고 있다”고 설명했다. 김 본부장은 이처럼 자산을 매각한 후에도 NH프라임리츠 포트폴리오 기준에 부합하는 신규자산 편입으로 안정적 배당을 지급할...",2023-12-14
